keywords,sentence,article_no,source,title or content
七匹狼,WOLF TOTEM（狼图腾）在米兰时装周的成功大秀，给深耕时尚的七匹狼集团带来了更多惊喜,0,媒体新闻,c,1
七匹狼,图：高伟光、徐峰立身着WOLF TOTEM潮流卫衣现场看秀观秀嘉宾（从左到右）：七匹狼董事长周少雄／特邀嘉宾高伟光／现代传播集团董事长邵忠／设计总监Colin Jiang创立于意大利的潮牌男装WOLF TOTEM（狼图腾）更是受到诸多买手的追捧，并将于今年秋冬进驻欧洲多个城市以及迪拜、东京、首尔、香港、台北等亚太地区的时尚买手店,0,媒体新闻,c,1
七匹狼,这股由潮流专家带动而起的“狼图腾”崇拜热潮，让WOLF TOTEM的母公司七匹狼集团惊喜不已,0,媒体新闻,c,1
七匹狼,作为中国男装行业的领先企业，七匹狼在渠道、供应链、市场支持等业务模块有二十余年的成熟积累，而依托集团优势打造的时尚服务平台希望为更多的新兴时尚品牌提供服务，从而为消费者带来更多的时尚选择,0,媒体新闻,c,1
七匹狼,七匹狼深耕时尚，WOLF TOTEM新品耀米兰,0,媒体新闻,t,1
七匹狼,在进一步看，光线传媒(行情300251，买入)、华谊兄弟(行情300027，买入)、七匹狼(行情002029，买入)三家上市公司通过多米音乐间接受益,1,媒体新闻,c,1
七匹狼,七匹狼年报显示，2016年，公司线上渠道继续保持了较高增速的发展，实现营业收入约9亿元，同比增长超过30%,2,媒体新闻,c,1
七匹狼,据中国证券报记者统计，探路者、七匹狼、报喜鸟、雅戈尔等公司在2016年“双十一”当月的天猫销售数据均占到全年天猫销售数据的40%以上,2,媒体新闻,c,1
七匹狼,创业之前，他担任七匹狼实业股份有限公司副总经理，负责主导该公司主标品牌的时尚化转型，使其受邀踏上了米兰时装周的T型台,3,媒体新闻,c,1
七匹狼,美学表达有两层含义，第一层是人群的美学，比如说在做七匹狼时尚化的时候，我们发现60年代、70年代 、80年代和90年代出生的人审美都不同，如果你想吸引90后进店，你的服装设计美学就要符合这个人群的审美标准,3,媒体新闻,c,1
七匹狼,七匹狼前高管：日本如何把零售做到极致？,3,媒体新闻,t,1
七匹狼,公司于行业内引领“总部提供专业化设计、照明器具定制化开发、品牌终端门对门服务”的商业模式，已与运动服饰领域的阿迪达斯、特步、安踏、哥伦比亚、耐克，时尚休闲服饰领域的绫致时装、美邦服饰、今誉服饰、都市丽人、赫基服饰、爱步，商务服饰领域的利郎、七匹狼、杰尼亚、爱马仕、宝姿、柒牌，以及其他领域的爱依瑞斯、金牌橱柜、富安娜、日春等知名企业建立了业务合作关系,4,媒体新闻,c,1
七匹狼,商务休闲男装隐现“转机”财报显示，商务休闲男装这一细分领域的两个“重量级”玩家七匹狼(002029.SZ)、九牧王(601566.SH)业绩出现回暖迹象,5,媒体新闻,c,1
七匹狼,2016年，七匹狼实现营业收入、归属母公司股东的净利润分别为26.40亿元和2.67亿元，同比增幅分别为6.16%和-2.14%，较2015年分别提高2.17%和3.29%；销售毛利率为43.93%，较2015年增加了1.08%,5,媒体新闻,c,1
七匹狼,若按季度走势来看，七匹狼业绩回暖迹象更为明显,5,媒体新闻,c,1
七匹狼,2016年一至四季度，七匹狼营业收入增幅分别为11.05%、-11.48%、1.37%和18.13%,5,媒体新闻,c,1
七匹狼,尤其是第三、四季度，七匹狼营业收入增速较上一年同期增加了11.3%和9.18%,5,媒体新闻,c,1
七匹狼,2017年一季度，七匹狼分别实现营业收入、归属母公司股东的净利润8.07亿元和7069万元，同比分别增长13.89%、9.81%，较上年同期分别提高2.84%、14.99%,5,媒体新闻,c,1
七匹狼,而九牧王近五个季度的业绩走势与七匹狼颇为相似,5,媒体新闻,c,1
七匹狼,截至2016年年末，七匹狼、九牧王预收账款余额分别为5.13亿元、1.29亿元，同比分别增长7.65%和42.94%,5,媒体新闻,c,1
七匹狼,报告期内，榕智靓丽的业绩和迅速成长的时尚业经验让七匹狼等机构伸出了橄榄枝，七匹狼旗下的七尚基金投资了榕智股份，并希望榕智助力自己的开放时尚平台,6,媒体新闻,c,1
七匹狼,周五盘后，现代传播首席内容官邵忠发布公告，宣布集团附属公司现代数码获得七匹狼投资的入股，后者为国内男装集团福建七匹狼(002029.SZ) 附属公司,7,媒体新闻,c,1
七匹狼,此次交易以现金形式达成，七匹狼投资以人民币4305.0万元(下简称元)购入现代数码扩股后428，570 股股份，而现代传播集团亦透过子公司E -Starship 增资3660.0万元,7,媒体新闻,c,1
七匹狼,交易完成后现代传播和七匹狼投资分别持有现代数码70%和30%股份,7,媒体新闻,c,1
七匹狼,此次现代传播引入七匹狼作为战略投资者并非无迹可寻，今年农历年年初，现代传播集团发布公告，宣布集团创始人、主席邵忠兼任集团首席内容官，自2月8日履新集团首次创立的职位至交易公布仅仅一个月时间，显示该集团重资源布局数字业务的最新战略或许早已开始,7,媒体新闻,c,1
七匹狼,对于与七匹狼的交易，现代集团主席、首席内容官邵忠在声明中表示，集团在新媒体运营方面拥有多年经验，先后推出多个优秀的数字媒体产品，渗透至各类精英人群，本次合作后，集团将会进一步提高在数字媒体领域的投入，加强内容布局，打造优质的新媒体内容产品以及在线服务产品,7,媒体新闻,c,1
七匹狼,七匹狼董事长周少雄则表示，此次入股是双方深度合作的第一步，未来潜力无穷，不局限于移动新媒体业务,7,媒体新闻,c,1
七匹狼,　　而“女人的善变”也让众多男装品牌纷纷涉足女装，海澜之家(600398，股吧)、利郎商务男装、七匹狼(002029，股吧)、九牧王(601566，股吧)和与狼共舞等均已试水另一半那个市场,8,媒体新闻,c,1
七匹狼,不过，除去依靠女装实现营收增长的“男人的衣柜”海澜之家外，无论是多年前在专卖店中增加女装品类的七匹狼，还是九牧王成立之初便推出专做女裤的“九牧妃”品牌，均因管理跟不上、产品做不精等各种原因，早早淡出大众视线,8,媒体新闻,c,1
七匹狼,作为福建省最具影响的国有企业和中国知名的卷烟制造基地之一，福建龙岩烟草工业有限责任公司生产的“七匹狼(行情002029，诊股)”牌香烟却被曝出多批次不合格,9,媒体新闻,c,0
七匹狼,    公开资料显示，“七匹狼”香烟隶属于福建龙岩烟草工业有限责任公司（原龙岩卷烟厂），是该公司的核心品牌，为中国驰名商标、中国名优卷烟品牌之一,9,媒体新闻,c,0
七匹狼,    近期有多名消费者向《中国产经新闻》记者反映称，多年来一直钟情的福建龙岩卷烟厂生产的红“七匹狼”硬盒装香烟，抽的感觉与以往不同，似乎与假烟一样，为此还有消费者与香烟销售点的老板发生过争执,9,媒体新闻,c,0
七匹狼,    根据数家香烟销售点提供的香烟以及进货单据显示，该“七匹狼”红色硬盒包装香烟为龙岩烟草工业有限责任公司生产,9,媒体新闻,c,0
七匹狼,    有知情人士向《中国产经新闻》记者提供了烟草公司内部发布的公告，根据《公告》内容显示：“因工厂生产设备出现故障，近段时间配送的红七匹狼中有小部分出现口味异常，具体为拆条后小盒包装底部钢印号2Q7314和2R7314”,9,媒体新闻,c,0
七匹狼,    同时该《公告》还要求各位零售客户售卖时拆条检查，在那个时间段订购的红七匹狼（若库存不多，也可先拆条检查），凡发现小盒底部钢印属上述号码的，请立即与客户经理联系调换,9,媒体新闻,c,0
七匹狼,    另外根据知情人士反映，“七匹狼”香烟的过滤嘴亦曾出现过不合格的情况，内部还曾有通报,9,媒体新闻,c,0
七匹狼,【青晰度】“七匹狼”香烟被曝多批次不合格,9,媒体新闻,t,0
